{
  "thread": "thread/0.1",
  "world": {
    "id": "menagerie",
    "title": "The Menagerie",
    "description": "Animunda’s garden — the universal creature roster made walkable, animas roaming their enclosures.",
    "author": {
      "id": "did:pixygon:pixygon",
      "name": "Pixygon"
    },
    "codex": [
      "anima-armaturus",
      "anima-buonic",
      "anima-carrotto",
      "anima-crabber",
      "anima-crabbolo",
      "anima-golgon",
      "anima-meeca",
      "anima-moorca",
      "anima-nightstalker",
      "anima-triox"
    ],
    "license": "CC-BY-4.0"
  },
  "environment": {
    "year": 0,
    "sky": {
      "zenith": [
        0.05,
        0.1,
        0.06
      ],
      "horizon": [
        0.16999999999999998,
        0.2,
        0.2
      ],
      "sun_dir": [
        0.3,
        0.7,
        0.2
      ]
    }
  },
  "spawns": [
    {
      "name": "entry",
      "position": [
        0,
        0,
        8
      ],
      "yaw": 3.14159
    }
  ],
  "prefabs": [
    {
      "id": "60000001",
      "mesh": {
        "builtin": "plane"
      },
      "material": {
        "base_color": [
          0.12,
          0.12,
          0.16,
          1
        ],
        "roughness": 0.95
      }
    },
    {
      "id": "60000002",
      "mesh": {
        "builtin": "cube"
      },
      "material": {
        "base_color": [
          0.5,
          0.8,
          0.4,
          1
        ],
        "roughness": 0.5,
        "metallic": 0.15
      }
    },
    {
      "id": "60000003",
      "mesh": {
        "builtin": "quad"
      },
      "material": {
        "base_color": [
          0.3,
          0.48,
          0.24,
          1
        ],
        "roughness": 0.7
      }
    },
    {
      "id": "60000004",
      "mesh": {
        "builtin": "cylinder"
      },
      "material": {
        "base_color": [
          0.5,
          0.8,
          0.4,
          1
        ],
        "roughness": 0.35,
        "metallic": 0.3
      }
    }
  ],
  "placements": [
    {
      "prefab": "60000001",
      "name": "floor",
      "position": [
        0,
        0,
        0
      ],
      "scale": [
        30,
        1,
        30
      ]
    },
    {
      "prefab": "60000002",
      "name": "pedestal:anima-armaturus",
      "position": [
        -6.3,
        0.5,
        -1
      ],
      "scale": [
        0.8,
        1,
        0.8
      ],
      "codex": "anima-armaturus",
      "behavior": "codex-viewer"
    },
    {
      "prefab": "60000002",
      "name": "pedestal:anima-buonic",
      "position": [
        -4.9,
        0.5,
        -3
      ],
      "scale": [
        0.8,
        1,
        0.8
      ],
      "codex": "anima-buonic",
      "behavior": "codex-viewer"
    },
    {
      "prefab": "60000002",
      "name": "pedestal:anima-carrotto",
      "position": [
        -3.5,
        0.5,
        -1
      ],
      "scale": [
        0.8,
        1,
        0.8
      ],
      "codex": "anima-carrotto",
      "behavior": "codex-viewer"
    },
    {
      "prefab": "60000002",
      "name": "pedestal:anima-crabber",
      "position": [
        -2.1,
        0.5,
        -3
      ],
      "scale": [
        0.8,
        1,
        0.8
      ],
      "codex": "anima-crabber",
      "behavior": "codex-viewer"
    },
    {
      "prefab": "60000002",
      "name": "pedestal:anima-crabbolo",
      "position": [
        -0.7,
        0.5,
        -1
      ],
      "scale": [
        0.8,
        1,
        0.8
      ],
      "codex": "anima-crabbolo",
      "behavior": "codex-viewer"
    },
    {
      "prefab": "60000002",
      "name": "pedestal:anima-golgon",
      "position": [
        0.7,
        0.5,
        -3
      ],
      "scale": [
        0.8,
        1,
        0.8
      ],
      "codex": "anima-golgon",
      "behavior": "codex-viewer"
    },
    {
      "prefab": "60000002",
      "name": "pedestal:anima-meeca",
      "position": [
        2.1,
        0.5,
        -1
      ],
      "scale": [
        0.8,
        1,
        0.8
      ],
      "codex": "anima-meeca",
      "behavior": "codex-viewer"
    },
    {
      "prefab": "60000002",
      "name": "pedestal:anima-moorca",
      "position": [
        3.5,
        0.5,
        -3
      ],
      "scale": [
        0.8,
        1,
        0.8
      ],
      "codex": "anima-moorca",
      "behavior": "codex-viewer"
    },
    {
      "prefab": "60000002",
      "name": "pedestal:anima-nightstalker",
      "position": [
        4.9,
        0.5,
        -1
      ],
      "scale": [
        0.8,
        1,
        0.8
      ],
      "codex": "anima-nightstalker",
      "behavior": "codex-viewer"
    },
    {
      "prefab": "60000002",
      "name": "pedestal:anima-triox",
      "position": [
        6.3,
        0.5,
        -3
      ],
      "scale": [
        0.8,
        1,
        0.8
      ],
      "codex": "anima-triox",
      "behavior": "codex-viewer"
    },
    {
      "prefab": "60000003",
      "name": "signboard",
      "position": [
        0,
        1.4,
        -7
      ],
      "scale": [
        6,
        2.4,
        0.2
      ],
      "behavior": "open-link",
      "data": {
        "kind": "signboard",
        "url": "https://animunda.pixygon.io",
        "tagline": "Animunda — the living roster."
      }
    }
  ],
  "portals": [
    {
      "id": "to-nexus",
      "position": [
        -10,
        1.4,
        0
      ],
      "scale": [
        2,
        3,
        0.2
      ],
      "to": "thread://pixygon.io#entry",
      "label": "The Nexus",
      "preview": "live"
    },
    {
      "id": "to-forge",
      "position": [
        10,
        1.4,
        0
      ],
      "scale": [
        2,
        3,
        0.2
      ],
      "to": "thread://pixiel.ai/forge#entry",
      "label": "The Forge",
      "preview": "live"
    }
  ],
  "behaviors": [
    {
      "id": "codex-viewer",
      "wasm": "codex-viewer-wasm",
      "on": [
        "interact"
      ]
    },
    {
      "id": "open-link",
      "wasm": "open-link-wasm",
      "on": [
        "interact"
      ]
    }
  ],
  "assets": [
    {
      "id": "codex-viewer-wasm",
      "uri": "behaviors/codex-viewer.wasm",
      "kind": "wasm"
    },
    {
      "id": "open-link-wasm",
      "uri": "behaviors/open-link.wasm",
      "kind": "wasm"
    }
  ],
  "presence": {
    "relay": null,
    "max_occupants": 64,
    "voice": true
  }
}
