{
  "thread": "thread/0.1",
  "world": {
    "id": "atlas",
    "title": "The Cartographer’s Hall",
    "description": "Kartograf’s map-room — the shape of places drawn and redrawn, coordinates for every world.",
    "author": {
      "id": "did:pixygon:pixygon",
      "name": "Pixygon"
    },
    "codex": [
      "world-manifest",
      "the-thread",
      "invaders-sigil",
      "bloodhound-hackle"
    ],
    "license": "CC-BY-4.0"
  },
  "environment": {
    "year": 0,
    "sky": {
      "zenith": [
        0.04,
        0.07,
        0.11
      ],
      "horizon": [
        0.16,
        0.17,
        0.25
      ],
      "sun_dir": [
        0.3,
        0.7,
        0.2
      ]
    }
  },
  "spawns": [
    {
      "name": "entry",
      "position": [
        0,
        0,
        8
      ],
      "yaw": 3.14159
    }
  ],
  "prefabs": [
    {
      "id": "60000001",
      "mesh": {
        "builtin": "plane"
      },
      "material": {
        "base_color": [
          0.12,
          0.12,
          0.16,
          1
        ],
        "roughness": 0.95
      }
    },
    {
      "id": "60000002",
      "mesh": {
        "builtin": "cube"
      },
      "material": {
        "base_color": [
          0.4,
          0.6,
          0.88,
          1
        ],
        "roughness": 0.5,
        "metallic": 0.15
      }
    },
    {
      "id": "60000003",
      "mesh": {
        "builtin": "quad"
      },
      "material": {
        "base_color": [
          0.24,
          0.36,
          0.528,
          1
        ],
        "roughness": 0.7
      }
    },
    {
      "id": "60000004",
      "mesh": {
        "builtin": "cylinder"
      },
      "material": {
        "base_color": [
          0.4,
          0.6,
          0.88,
          1
        ],
        "roughness": 0.35,
        "metallic": 0.3
      }
    }
  ],
  "placements": [
    {
      "prefab": "60000001",
      "name": "floor",
      "position": [
        0,
        0,
        0
      ],
      "scale": [
        30,
        1,
        30
      ]
    },
    {
      "prefab": "60000002",
      "name": "pedestal:world-manifest",
      "position": [
        -4.5,
        0.5,
        -1
      ],
      "scale": [
        0.8,
        1,
        0.8
      ],
      "codex": "world-manifest",
      "behavior": "codex-viewer"
    },
    {
      "prefab": "60000002",
      "name": "pedestal:the-thread",
      "position": [
        -1.5,
        0.5,
        -3
      ],
      "scale": [
        0.8,
        1,
        0.8
      ],
      "codex": "the-thread",
      "behavior": "codex-viewer"
    },
    {
      "prefab": "60000002",
      "name": "pedestal:invaders-sigil",
      "position": [
        1.5,
        0.5,
        -1
      ],
      "scale": [
        0.8,
        1,
        0.8
      ],
      "codex": "invaders-sigil",
      "behavior": "codex-viewer"
    },
    {
      "prefab": "60000002",
      "name": "pedestal:bloodhound-hackle",
      "position": [
        4.5,
        0.5,
        -3
      ],
      "scale": [
        0.8,
        1,
        0.8
      ],
      "codex": "bloodhound-hackle",
      "behavior": "codex-viewer"
    },
    {
      "prefab": "60000003",
      "name": "signboard",
      "position": [
        0,
        1.4,
        -7
      ],
      "scale": [
        6,
        2.4,
        0.2
      ],
      "behavior": "open-link",
      "data": {
        "kind": "signboard",
        "url": "https://kartograf.pixygon.io",
        "tagline": "Kartograf — every place, mapped."
      }
    }
  ],
  "portals": [
    {
      "id": "to-nexus",
      "position": [
        -10,
        1.4,
        0
      ],
      "scale": [
        2,
        3,
        0.2
      ],
      "to": "thread://pixygon.io#entry",
      "label": "The Nexus",
      "preview": "live"
    },
    {
      "id": "to-feed",
      "position": [
        10,
        1.4,
        0
      ],
      "scale": [
        2,
        3,
        0.2
      ],
      "to": "thread://corefeed.pixygon.io/feed#entry",
      "label": "The Feed",
      "preview": "live"
    }
  ],
  "behaviors": [
    {
      "id": "codex-viewer",
      "wasm": "codex-viewer-wasm",
      "on": [
        "interact"
      ]
    },
    {
      "id": "open-link",
      "wasm": "open-link-wasm",
      "on": [
        "interact"
      ]
    }
  ],
  "assets": [
    {
      "id": "codex-viewer-wasm",
      "uri": "behaviors/codex-viewer.wasm",
      "kind": "wasm"
    },
    {
      "id": "open-link-wasm",
      "uri": "behaviors/open-link.wasm",
      "kind": "wasm"
    }
  ],
  "presence": {
    "relay": null,
    "max_occupants": 64,
    "voice": true
  }
}
