{"thread":"thread/0.1","world":{"id":"commons","title":"The Commons","description":"A warm, round hall where travelers gather and talk. At its heart, a plinth of the Thread itself; around it, room to meet. When presence is live, you will not be alone here — the point of a place is the people in it.","author":{"id":"did:pixygon:pixygon","name":"Pixygon"},"codex":["the-thread","world-manifest"],"license":"CC-BY-4.0"},"environment":{"year":0,"sky":{"zenith":[0.04,0.05,0.09],"horizon":[0.16,0.15000000000000002,0.23],"sun_dir":[0.3,0.7,0.2]}},"spawns":[{"name":"entry","position":[0,0,8],"yaw":3.14159}],"prefabs":[{"id":"60000001","mesh":{"builtin":"plane"},"material":{"base_color":[0.12,0.12,0.16,1],"roughness":0.95}},{"id":"60000002","mesh":{"builtin":"cube"},"material":{"base_color":[0.55,0.7,0.92,1],"roughness":0.5,"metallic":0.15}},{"id":"60000003","mesh":{"builtin":"quad"},"material":{"base_color":[0.33,0.42,0.552,1],"roughness":0.7}},{"id":"60000004","mesh":{"builtin":"cylinder"},"material":{"base_color":[0.55,0.7,0.92,1],"roughness":0.35,"metallic":0.3}}],"placements":[{"prefab":"60000001","name":"floor","position":[0,0,0],"scale":[30,1,30]},{"prefab":"60000002","name":"pedestal:the-thread","position":[-1.5,0.5,-1],"scale":[0.8,1,0.8],"codex":"the-thread","behavior":"codex-viewer"},{"prefab":"60000002","name":"pedestal:world-manifest","position":[1.5,0.5,-3],"scale":[0.8,1,0.8],"codex":"world-manifest","behavior":"codex-viewer"}],"portals":[{"id":"to-nexus","position":[0,1.4,-6],"scale":[2,3,0.2],"to":"thread://pixygon.io#entry","label":"The Nexus","preview":"live"}],"behaviors":[{"id":"codex-viewer","wasm":"codex-viewer-wasm","on":["interact"]},{"id":"open-link","wasm":"open-link-wasm","on":["interact"]}],"assets":[{"id":"codex-viewer-wasm","uri":"behaviors/codex-viewer.wasm","kind":"wasm"},{"id":"open-link-wasm","uri":"behaviors/open-link.wasm","kind":"wasm"}],"presence":{"relays":[],"relay":null,"max_occupants":64,"voice":true}}
