{
  "thread": "thread/0.1",
  "world": {
    "id": "market",
    "title": "The Bazaar",
    "description": "A walkable market on the Thread. Each stall holds a real item — inspect it for its Codex entry, or buy it with your Passport. Step through the veil to return to the Archive.",
    "author": { "id": "did:pixygon:pixygon", "name": "Pixygon" },
    "codex": ["the-pearl-dress"],
    "license": "CC-BY-4.0"
  },
  "environment": {
    "year": 2024,
    "sky": { "zenith": [0.10, 0.15, 0.42], "horizon": [0.55, 0.62, 0.78], "sun_dir": [0.5, 0.6, 0.3] }
  },
  "spawns": [
    { "name": "entry", "position": [0.0, 0.0, 6.0], "yaw": 3.14159 }
  ],
  "prefabs": [
    { "id": "60000001", "mesh": { "builtin": "plane" }, "material": { "base_color": [0.30, 0.26, 0.18, 1.0], "roughness": 0.95 } },
    { "id": "60000010", "mesh": { "builtin": "cube" }, "material": { "base_color": [0.45, 0.30, 0.16, 1.0], "roughness": 0.8 } },
    { "id": "60000011", "mesh": { "builtin": "cube" }, "material": { "base_color": [0.85, 0.72, 0.30, 1.0], "roughness": 0.35, "metallic": 0.4 } }
  ],
  "placements": [
    { "prefab": "60000001", "name": "ground", "position": [0.0, 0.0, 0.0], "scale": [24.0, 1.0, 24.0] },

    { "prefab": "60000010", "name": "stall:blade", "position": [-3.0, 0.5, 0.0], "scale": [1.2, 1.0, 1.2] },
    { "prefab": "60000011", "name": "wares:blade", "position": [-3.0, 1.3, 0.0], "scale": [0.4, 0.4, 0.4],
      "behavior": "buy", "codex": "the-veilwalkers",
      "data": { "item": "21010001", "name": "Veilwalker Blade", "price": 250, "currency": "gold" } },

    { "prefab": "60000010", "name": "stall:tonic", "position": [0.0, 0.5, -2.0], "scale": [1.2, 1.0, 1.2] },
    { "prefab": "60000011", "name": "wares:tonic", "position": [0.0, 1.3, -2.0], "scale": [0.4, 0.4, 0.4],
      "behavior": "buy",
      "data": { "item": "24010005", "name": "Caul Tonic", "price": 40, "currency": "gold" } },

    { "prefab": "60000010", "name": "stall:sigil", "position": [3.0, 0.5, 0.0], "scale": [1.2, 1.0, 1.2] },
    { "prefab": "60000011", "name": "wares:sigil", "position": [3.0, 1.3, 0.0], "scale": [0.4, 0.4, 0.4],
      "behavior": "buy", "codex": "the-veil",
      "data": { "item": "26010003", "name": "Sigil Gem", "price": 900, "currency": "gold" } }
  ],
  "portals": [
    { "id": "to-archive", "position": [0.0, 1.2, -6.0], "scale": [2.0, 3.0, 0.2],
      "to": "thread://archive.pixygon.io/codex-archive#entry", "label": "The Archive", "preview": "live" }
  ],
  "behaviors": [
    { "id": "buy", "wasm": "commerce-wasm", "on": ["interact"] }
  ],
  "assets": [
    { "id": "commerce-wasm", "uri": "behaviors/commerce.wasm", "kind": "wasm" }
  ],
  "presence": { "relay": "thread://relay.pixygon.io/market", "max_occupants": 64, "voice": true }
}
