{
  "thread": "thread/0.1",
  "world": {
    "id": "feed",
    "title": "The Feed",
    "description": "CoreFeed’s gallery — a living wall of what the ecosystem is making right now, updating as you watch.",
    "author": {
      "id": "did:pixygon:pixygon",
      "name": "Pixygon"
    },
    "codex": [
      "the-thread",
      "houndfang",
      "bloodhound-hackle",
      "dread-marrow"
    ],
    "license": "CC-BY-4.0"
  },
  "environment": {
    "year": 0,
    "sky": {
      "zenith": [
        0.1,
        0.05,
        0.06
      ],
      "horizon": [
        0.22,
        0.15000000000000002,
        0.2
      ],
      "sun_dir": [
        0.3,
        0.7,
        0.2
      ]
    }
  },
  "spawns": [
    {
      "name": "entry",
      "position": [
        0,
        0,
        8
      ],
      "yaw": 3.14159
    }
  ],
  "prefabs": [
    {
      "id": "60000001",
      "mesh": {
        "builtin": "plane"
      },
      "material": {
        "base_color": [
          0.12,
          0.12,
          0.16,
          1
        ],
        "roughness": 0.95
      }
    },
    {
      "id": "60000002",
      "mesh": {
        "builtin": "cube"
      },
      "material": {
        "base_color": [
          0.85,
          0.35,
          0.4,
          1
        ],
        "roughness": 0.5,
        "metallic": 0.15
      }
    },
    {
      "id": "60000003",
      "mesh": {
        "builtin": "quad"
      },
      "material": {
        "base_color": [
          0.51,
          0.21,
          0.24,
          1
        ],
        "roughness": 0.7
      }
    },
    {
      "id": "60000004",
      "mesh": {
        "builtin": "cylinder"
      },
      "material": {
        "base_color": [
          0.85,
          0.35,
          0.4,
          1
        ],
        "roughness": 0.35,
        "metallic": 0.3
      }
    }
  ],
  "placements": [
    {
      "prefab": "60000001",
      "name": "floor",
      "position": [
        0,
        0,
        0
      ],
      "scale": [
        30,
        1,
        30
      ]
    },
    {
      "prefab": "60000002",
      "name": "pedestal:the-thread",
      "position": [
        -4.5,
        0.5,
        -1
      ],
      "scale": [
        0.8,
        1,
        0.8
      ],
      "codex": "the-thread",
      "behavior": "codex-viewer"
    },
    {
      "prefab": "60000002",
      "name": "pedestal:houndfang",
      "position": [
        -1.5,
        0.5,
        -3
      ],
      "scale": [
        0.8,
        1,
        0.8
      ],
      "codex": "houndfang",
      "behavior": "codex-viewer"
    },
    {
      "prefab": "60000002",
      "name": "pedestal:bloodhound-hackle",
      "position": [
        1.5,
        0.5,
        -1
      ],
      "scale": [
        0.8,
        1,
        0.8
      ],
      "codex": "bloodhound-hackle",
      "behavior": "codex-viewer"
    },
    {
      "prefab": "60000002",
      "name": "pedestal:dread-marrow",
      "position": [
        4.5,
        0.5,
        -3
      ],
      "scale": [
        0.8,
        1,
        0.8
      ],
      "codex": "dread-marrow",
      "behavior": "codex-viewer"
    },
    {
      "prefab": "60000003",
      "name": "signboard",
      "position": [
        0,
        1.4,
        -7
      ],
      "scale": [
        6,
        2.4,
        0.2
      ],
      "behavior": "open-link",
      "data": {
        "kind": "signboard",
        "url": "https://corefeed.pixygon.io",
        "tagline": "CoreFeed — the pulse of the pearls."
      }
    }
  ],
  "portals": [
    {
      "id": "to-nexus",
      "position": [
        -10,
        1.4,
        0
      ],
      "scale": [
        2,
        3,
        0.2
      ],
      "to": "thread://pixygon.io#entry",
      "label": "The Nexus",
      "preview": "live"
    },
    {
      "id": "to-menagerie",
      "position": [
        10,
        1.4,
        0
      ],
      "scale": [
        2,
        3,
        0.2
      ],
      "to": "thread://animunda.pixygon.io/menagerie#entry",
      "label": "The Menagerie",
      "preview": "live"
    }
  ],
  "behaviors": [
    {
      "id": "codex-viewer",
      "wasm": "codex-viewer-wasm",
      "on": [
        "interact"
      ]
    },
    {
      "id": "open-link",
      "wasm": "open-link-wasm",
      "on": [
        "interact"
      ]
    }
  ],
  "assets": [
    {
      "id": "codex-viewer-wasm",
      "uri": "behaviors/codex-viewer.wasm",
      "kind": "wasm"
    },
    {
      "id": "open-link-wasm",
      "uri": "behaviors/open-link.wasm",
      "kind": "wasm"
    }
  ],
  "presence": {
    "relay": null,
    "max_occupants": 64,
    "voice": true
  }
}
