{
  "thread": "thread/0.1",
  "world": {
    "id": "forge",
    "title": "The Forge",
    "description": "Pixiel’s workshop — where raw prompts are hammered into images, video, sound and worlds. The tools of the makers.",
    "author": {
      "id": "did:pixygon:pixygon",
      "name": "Pixygon"
    },
    "codex": [
      "everknight-cinder",
      "everknight-clod",
      "everknight-tear",
      "tarnished-cog",
      "toaster-carapace"
    ],
    "license": "CC-BY-4.0"
  },
  "environment": {
    "year": 0,
    "sky": {
      "zenith": [
        0.1,
        0.06,
        0.04
      ],
      "horizon": [
        0.22,
        0.16,
        0.18000000000000002
      ],
      "sun_dir": [
        0.3,
        0.7,
        0.2
      ]
    }
  },
  "spawns": [
    {
      "name": "entry",
      "position": [
        0,
        0,
        8
      ],
      "yaw": 3.14159
    }
  ],
  "prefabs": [
    {
      "id": "60000001",
      "mesh": {
        "builtin": "plane"
      },
      "material": {
        "base_color": [
          0.12,
          0.12,
          0.16,
          1
        ],
        "roughness": 0.95
      }
    },
    {
      "id": "60000002",
      "mesh": {
        "builtin": "cube"
      },
      "material": {
        "base_color": [
          0.93,
          0.55,
          0.22,
          1
        ],
        "roughness": 0.5,
        "metallic": 0.15
      }
    },
    {
      "id": "60000003",
      "mesh": {
        "builtin": "quad"
      },
      "material": {
        "base_color": [
          0.558,
          0.33,
          0.132,
          1
        ],
        "roughness": 0.7
      }
    },
    {
      "id": "60000004",
      "mesh": {
        "builtin": "cylinder"
      },
      "material": {
        "base_color": [
          0.93,
          0.55,
          0.22,
          1
        ],
        "roughness": 0.35,
        "metallic": 0.3
      }
    }
  ],
  "placements": [
    {
      "prefab": "60000001",
      "name": "floor",
      "position": [
        0,
        0,
        0
      ],
      "scale": [
        30,
        1,
        30
      ]
    },
    {
      "prefab": "60000002",
      "name": "pedestal:everknight-cinder",
      "position": [
        -5.6,
        0.5,
        -1
      ],
      "scale": [
        0.8,
        1,
        0.8
      ],
      "codex": "everknight-cinder",
      "behavior": "codex-viewer"
    },
    {
      "prefab": "60000002",
      "name": "pedestal:everknight-clod",
      "position": [
        -2.8,
        0.5,
        -3
      ],
      "scale": [
        0.8,
        1,
        0.8
      ],
      "codex": "everknight-clod",
      "behavior": "codex-viewer"
    },
    {
      "prefab": "60000002",
      "name": "pedestal:everknight-tear",
      "position": [
        0,
        0.5,
        -1
      ],
      "scale": [
        0.8,
        1,
        0.8
      ],
      "codex": "everknight-tear",
      "behavior": "codex-viewer"
    },
    {
      "prefab": "60000002",
      "name": "pedestal:tarnished-cog",
      "position": [
        2.8,
        0.5,
        -3
      ],
      "scale": [
        0.8,
        1,
        0.8
      ],
      "codex": "tarnished-cog",
      "behavior": "codex-viewer"
    },
    {
      "prefab": "60000002",
      "name": "pedestal:toaster-carapace",
      "position": [
        5.6,
        0.5,
        -1
      ],
      "scale": [
        0.8,
        1,
        0.8
      ],
      "codex": "toaster-carapace",
      "behavior": "codex-viewer"
    },
    {
      "prefab": "60000003",
      "name": "signboard",
      "position": [
        0,
        1.4,
        -7
      ],
      "scale": [
        6,
        2.4,
        0.2
      ],
      "behavior": "open-link",
      "data": {
        "kind": "signboard",
        "url": "https://pixiel.ai",
        "tagline": "Pixiel.ai — the makers’ forge."
      }
    }
  ],
  "portals": [
    {
      "id": "to-nexus",
      "position": [
        -10,
        1.4,
        0
      ],
      "scale": [
        2,
        3,
        0.2
      ],
      "to": "thread://pixygon.io#entry",
      "label": "The Nexus",
      "preview": "live"
    },
    {
      "id": "to-ledger",
      "position": [
        10,
        1.4,
        0
      ],
      "scale": [
        2,
        3,
        0.2
      ],
      "to": "thread://lonnlyst.pixygon.io/ledger#entry",
      "label": "The Ledger Hall",
      "preview": "live"
    }
  ],
  "behaviors": [
    {
      "id": "codex-viewer",
      "wasm": "codex-viewer-wasm",
      "on": [
        "interact"
      ]
    },
    {
      "id": "open-link",
      "wasm": "open-link-wasm",
      "on": [
        "interact"
      ]
    }
  ],
  "assets": [
    {
      "id": "codex-viewer-wasm",
      "uri": "behaviors/codex-viewer.wasm",
      "kind": "wasm"
    },
    {
      "id": "open-link-wasm",
      "uri": "behaviors/open-link.wasm",
      "kind": "wasm"
    }
  ],
  "presence": {
    "relay": null,
    "max_occupants": 64,
    "voice": true
  }
}
